{"schema_version":"v1","scenario_name":"healthy_10k_intermit_offline","device_count":10000,"duration_seconds":21600,"failure_probability":0.0,"online_probability":0.70,"message_loss_probability":0.0,"message_duplication_probability":0.0,"rollback_success_probability":1.0,"health_failure_probability":0.0,"device_restart_probability":0.02,"mean_offline_duration_seconds":3600}
